{
  "make": "Citroen",
  "make_he": "סיטרואן",
  "importer": "דוד לובינסקי (סיטרואן)",
  "time_based": [],
  "status": "reviewed",
  "id": "citroen-c3-c4-ds3-2009-2015-1.6-vti",
  "model": "C3 / C4 / DS3 / C3 Picasso",
  "model_he": "C3 / C4 / DS3 / C3 פיקאסו",
  "generation": "C3 (SC), C4 (B7), DS3, C3 Picasso",
  "years": [
    2009,
    2015
  ],
  "engines": [
    "1.6 VTi 120 EP6 (5FS / 5F01 / 5FW)"
  ],
  "fuel": "petrol",
  "interval": {
    "km": 20000,
    "months": 12,
    "note": "עמודת התנאים הקשים בחוברת היבואן ל\"דגמים אחרים ומנועים אחרים\": 20,000 ק\"מ או שנה (בתנאים רגילים 30,000 ק\"מ או שנתיים)"
  },
  "cycle_km": 40000,
  "services": [
    {
      "km": 20000,
      "items": [
        {
          "item": "parking_brake",
          "action": "inspect",
          "note": "בדיקות בתוך הרכב (בלם חניה, צופר)"
        },
        {
          "item": "lights",
          "action": "inspect",
          "note": "פנסים ואורות"
        },
        {
          "item": "tires",
          "action": "inspect",
          "note": "מצב הצמיגים; תוקף ערכת תיקון התקר וחיישני לחץ האוויר אם קיימים"
        },
        {
          "item": "brake_pads",
          "action": "inspect",
          "note": "בדיקת בטיחות של הבלמים מתחת לרכב"
        },
        {
          "item": "steering",
          "action": "inspect",
          "note": "בדיקת בטיחות של ההיגוי"
        },
        {
          "item": "body_underside",
          "action": "inspect",
          "note": "דליפות ממעגלי הנוזלים ומתיבת ההילוכים"
        },
        {
          "item": "washer_fluid",
          "action": "inspect",
          "note": "השלמה לפי הצורך"
        },
        {
          "item": "brake_fluid",
          "action": "inspect",
          "note": "מפלס והשלמה לפי הצורך"
        },
        {
          "item": "diagnostics",
          "action": "inspect",
          "note": "בדיקת מחשבי הרכב, בדיקות הנדרשות לפי החוק, איפוס מחוון השירות ונסיעת מבחן"
        },
        {
          "item": "engine_oil",
          "action": "replace"
        },
        {
          "item": "oil_filter",
          "action": "replace"
        },
        {
          "item": "cabin_filter",
          "action": "replace",
          "note": "כל 20,000 ק\"מ או שנה"
        }
      ]
    },
    {
      "km": 40000,
      "items": [
        {
          "item": "parking_brake",
          "action": "inspect",
          "note": "בדיקות בתוך הרכב (בלם חניה, צופר)"
        },
        {
          "item": "lights",
          "action": "inspect",
          "note": "פנסים ואורות"
        },
        {
          "item": "tires",
          "action": "inspect",
          "note": "מצב הצמיגים; תוקף ערכת תיקון התקר וחיישני לחץ האוויר אם קיימים"
        },
        {
          "item": "brake_pads",
          "action": "inspect",
          "note": "בדיקת בטיחות של הבלמים מתחת לרכב"
        },
        {
          "item": "steering",
          "action": "inspect",
          "note": "בדיקת בטיחות של ההיגוי"
        },
        {
          "item": "body_underside",
          "action": "inspect",
          "note": "דליפות ממעגלי הנוזלים ומתיבת ההילוכים"
        },
        {
          "item": "washer_fluid",
          "action": "inspect",
          "note": "השלמה לפי הצורך"
        },
        {
          "item": "brake_fluid",
          "action": "inspect",
          "note": "מפלס והשלמה לפי הצורך"
        },
        {
          "item": "diagnostics",
          "action": "inspect",
          "note": "בדיקת מחשבי הרכב, בדיקות הנדרשות לפי החוק, איפוס מחוון השירות ונסיעת מבחן"
        },
        {
          "item": "engine_oil",
          "action": "replace"
        },
        {
          "item": "oil_filter",
          "action": "replace"
        },
        {
          "item": "cabin_filter",
          "action": "replace",
          "note": "כל 20,000 ק\"מ או שנה"
        },
        {
          "item": "air_filter",
          "action": "replace",
          "note": "כל 40,000 ק\"מ"
        },
        {
          "item": "spark_plugs",
          "action": "replace",
          "note": "כל 40,000 ק\"מ"
        }
      ]
    }
  ],
  "long_interval": [
    {
      "item": "brake_fluid",
      "action": "replace",
      "every_months": 24,
      "note": "כל שנתיים"
    },
    {
      "item": "coolant",
      "action": "inspect",
      "first_km": 120000,
      "first_months": 48,
      "then_every_km": 20000,
      "then_every_months": 12,
      "note": "בדיקת נוזל הקירור: לראשונה ב-120,000 ק\"מ או 4 שנים, ואחר כך בכל טיפול"
    }
  ],
  "specs": {
    "timing": "שרשרת תזמון (החוברת: הנחיית רצועת התזמון אינה חלה על מנועים עם שרשרת)",
    "_note": "נבדק מול חוברת השירות והאחריות העברית של סיטרואן (לובינסקי, 2009)"
  },
  "sources": [
    {
      "url": "https://web.archive.org/web/20120509205507/http://citroen.co.il/_Uploads/dbsAttachedFiles/CitroenWarrantyBook.pdf",
      "kind": "importer",
      "note": "חוברת השירות והאחריות העברית של סיטרואן (לובינסקי, מהדורה 08/2009, KGCIT0920) מאתר citroen.co.il, עותק web.archive.org מ-9.5.2012. מרווחים לפי סוג מנוע עמ' 11 (PDF 13), פעולות קבועות בכל טיפול עמ' 12 (PDF 14), פעולות נוספות לתנאים קשים עמ' 17-18 (PDF 19-20), רצועת תזמון ומסנן חלקיקים עמ' 19 (PDF 21)"
    }
  ],
  "notes": "התוכנית לפי חוברת השירות והאחריות העברית של לובינסקי לסיטרואן (מהדורת 2009, שפורסמה באתר סיטרואן ישראל לפחות עד 2012); לדגמי 2013-2015 לא נמצאה מהדורה מאוחרת יותר. החוברת נותנת שתי תוכניות: רגילה ותנאים קשים. רשימת התנאים הקשים כוללת שימוש מתמשך בארצות חמות (מעל 30 מעלות לעיתים קרובות) ובאזורים מאובקים, וכן נסיעות קצרות ושימוש עירוני, ולכן נבחרה עמודת התנאים הקשים. בכל טיפול: שמן ומסנן שמן, מסנן אוויר לתא הנוסעים ובדיקות הבטיחות והנוזלים. כל 40,000 ק\"מ גם מסנן אוויר ומצתים. נוזל בלמים כל שנתיים; נוזל הקירור נבדק מ-120,000 ק\"מ או 4 שנים ואילך בכל טיפול. למנוע VTi שרשרת תזמון. ברישוי: מנועים 5FS, 5F01, 5FW."
}
