{
  "id": "nissan-nv200-2012-2019-1.5-diesel",
  "make": "Nissan",
  "make_he": "ניסאן",
  "model": "NV200",
  "model_he": "NV200",
  "generation": "M20",
  "years": [
    2012,
    2019
  ],
  "engines": [
    "1.5 dCi (K9K)"
  ],
  "fuel": "diesel",
  "importer": "פריסבי (קרסו מוטורס)",
  "interval": {
    "km": 30000,
    "months": 12,
    "note": "טיפול כל 30,000 ק\"מ או שנה, המוקדם (רכב ללא וו גרירה; עם וו גרירה כל 15,000 ק\"מ)"
  },
  "cycle_km": 150000,
  "services": [
    {
      "km": 30000,
      "items": [
        {
          "item": "engine_oil",
          "action": "replace"
        },
        {
          "item": "oil_filter",
          "action": "replace"
        },
        {
          "item": "air_filter",
          "action": "inspect"
        },
        {
          "item": "cabin_filter",
          "action": "replace",
          "note": "בנסועה שנתית של פחות מ-15,000 ק\"מ: החלפה כל שנתיים"
        },
        {
          "item": "fuel_filter",
          "action": "clean",
          "note": "ניקוז מים ממסנן הסולר (בלי החלפה)"
        },
        {
          "item": "brake_pads",
          "action": "inspect",
          "note": "בדיקת הבלמים מלפנים ומאחור"
        },
        {
          "item": "tire_rotation",
          "action": "rotate"
        },
        {
          "item": "coolant",
          "action": "inspect",
          "note": "לפי הערת השוליים ההחלפה הראשונה ב-90,000 ק\"מ או 5 שנים (ראו מרווח ארוך); הטבלה מסמנת החלפה ב-150,000"
        },
        {
          "item": "brake_fluid",
          "action": "inspect"
        },
        {
          "item": "manual_gearbox_oil",
          "action": "inspect"
        }
      ]
    },
    {
      "km": 60000,
      "items": [
        {
          "item": "engine_oil",
          "action": "replace"
        },
        {
          "item": "oil_filter",
          "action": "replace"
        },
        {
          "item": "air_filter",
          "action": "replace"
        },
        {
          "item": "cabin_filter",
          "action": "replace",
          "note": "בנסועה שנתית של פחות מ-15,000 ק\"מ: החלפה כל שנתיים"
        },
        {
          "item": "fuel_filter",
          "action": "replace"
        },
        {
          "item": "brake_pads",
          "action": "inspect",
          "note": "בדיקת הבלמים מלפנים ומאחור"
        },
        {
          "item": "tire_rotation",
          "action": "rotate"
        },
        {
          "item": "coolant",
          "action": "inspect",
          "note": "לפי הערת השוליים ההחלפה הראשונה ב-90,000 ק\"מ או 5 שנים (ראו מרווח ארוך); הטבלה מסמנת החלפה ב-150,000"
        },
        {
          "item": "brake_fluid",
          "action": "replace"
        },
        {
          "item": "manual_gearbox_oil",
          "action": "inspect"
        }
      ]
    },
    {
      "km": 90000,
      "items": [
        {
          "item": "engine_oil",
          "action": "replace"
        },
        {
          "item": "oil_filter",
          "action": "replace"
        },
        {
          "item": "air_filter",
          "action": "inspect"
        },
        {
          "item": "cabin_filter",
          "action": "replace",
          "note": "בנסועה שנתית של פחות מ-15,000 ק\"מ: החלפה כל שנתיים"
        },
        {
          "item": "fuel_filter",
          "action": "clean",
          "note": "ניקוז מים ממסנן הסולר (בלי החלפה)"
        },
        {
          "item": "brake_pads",
          "action": "inspect",
          "note": "בדיקת הבלמים מלפנים ומאחור"
        },
        {
          "item": "tire_rotation",
          "action": "rotate"
        },
        {
          "item": "coolant",
          "action": "inspect",
          "note": "לפי הערת השוליים ההחלפה הראשונה ב-90,000 ק\"מ או 5 שנים (ראו מרווח ארוך); הטבלה מסמנת החלפה ב-150,000"
        },
        {
          "item": "brake_fluid",
          "action": "inspect"
        },
        {
          "item": "manual_gearbox_oil",
          "action": "inspect"
        }
      ]
    },
    {
      "km": 120000,
      "items": [
        {
          "item": "engine_oil",
          "action": "replace"
        },
        {
          "item": "oil_filter",
          "action": "replace"
        },
        {
          "item": "air_filter",
          "action": "replace"
        },
        {
          "item": "cabin_filter",
          "action": "replace",
          "note": "בנסועה שנתית של פחות מ-15,000 ק\"מ: החלפה כל שנתיים"
        },
        {
          "item": "fuel_filter",
          "action": "replace"
        },
        {
          "item": "brake_pads",
          "action": "inspect",
          "note": "בדיקת הבלמים מלפנים ומאחור"
        },
        {
          "item": "tire_rotation",
          "action": "rotate"
        },
        {
          "item": "coolant",
          "action": "inspect",
          "note": "לפי הערת השוליים ההחלפה הראשונה ב-90,000 ק\"מ או 5 שנים (ראו מרווח ארוך); הטבלה מסמנת החלפה ב-150,000"
        },
        {
          "item": "brake_fluid",
          "action": "replace"
        },
        {
          "item": "manual_gearbox_oil",
          "action": "inspect"
        }
      ]
    },
    {
      "km": 150000,
      "items": [
        {
          "item": "engine_oil",
          "action": "replace"
        },
        {
          "item": "oil_filter",
          "action": "replace"
        },
        {
          "item": "air_filter",
          "action": "inspect"
        },
        {
          "item": "cabin_filter",
          "action": "replace",
          "note": "בנסועה שנתית של פחות מ-15,000 ק\"מ: החלפה כל שנתיים"
        },
        {
          "item": "fuel_filter",
          "action": "clean",
          "note": "ניקוז מים ממסנן הסולר (בלי החלפה)"
        },
        {
          "item": "brake_pads",
          "action": "inspect",
          "note": "בדיקת הבלמים מלפנים ומאחור"
        },
        {
          "item": "tire_rotation",
          "action": "rotate"
        },
        {
          "item": "coolant",
          "action": "replace",
          "note": "לפי הערת השוליים ההחלפה הראשונה ב-90,000 ק\"מ או 5 שנים (ראו מרווח ארוך); הטבלה מסמנת החלפה ב-150,000"
        },
        {
          "item": "brake_fluid",
          "action": "inspect"
        },
        {
          "item": "manual_gearbox_oil",
          "action": "inspect"
        },
        {
          "item": "timing_belt",
          "action": "replace",
          "note": "רצועת תזמון ומותח: כל 150,000 ק\"מ או 5 שנים, המוקדם"
        }
      ]
    }
  ],
  "long_interval": [
    {
      "item": "coolant",
      "action": "replace",
      "first_km": 90000,
      "first_months": 60,
      "then_every_km": 60000,
      "then_every_months": 48,
      "note": "הערת שוליים בטבלת היבואן: החלפה ראשונה ב-90,000 ק\"מ או 5 שנים ואחר כך כל 60,000 ק\"מ או 4 שנים"
    },
    {
      "item": "timing_belt",
      "action": "replace",
      "every_km": 150000,
      "every_months": 60,
      "note": "רצועת תזמון ומותח: כל 150,000 ק\"מ או 5 שנים, המוקדם (הערת שוליים בטבלה)"
    }
  ],
  "time_based": [],
  "specs": {
    "engine_oil": "דיזל עם מסנן חלקיקים: ACEA C4 בצמיגות 5W-30 (לפי טבלת השמנים בחוברת היבואן)",
    "warranty": "5 שנים או 160,000 ק\"מ, המוקדם (בשנתיים הראשונות ללא הגבלת ק\"מ); צבע ושיתוך 5 שנים (חוברת 2016, נבארה ו-NV200)"
  },
  "sources": [
    {
      "url": "http://carz.co.il.s3.amazonaws.com/files/NewVehicle_Warranty.pdf",
      "kind": "importer",
      "note": "חוברת אחריות ושירות של קרסו מוטורס לרכבי ניסאן (מהדורת אוגוסט 2016, עותק של החוברת הישראלית שהועלה לאתר carz.co.il). טבלת מועדי הטיפול לפי דגם בעמ' 18 בחוברת, סוגי שמן בעמ' 17, אחריות בעמ' 5-6; טבלאות NV200 M20 בעמ' 33-34 (עמ' 34-35 בקובץ); הלוח כאן הוא הטבלה לרכב ללא וו גרירה"
    },
    {
      "url": "https://www.nissan-cdn.net/content/dam/Nissan/israel/services/warrenty-pdf/NewVehicle_Warranty.pdf",
      "kind": "importer",
      "note": "כתב האחריות לרכב חדש של ניסאן ישראל (2017) בתיקיית החוברות באתר ניסאן ישראל, יחד עם חוברות NT500/LEAF/GT-R מאותה סדרה (אוגוסט 2016). אין בו טבלת טיפולים; מאשר שמדובר בסדרת החוברות של היבואן"
    },
    {
      "url": "https://www.nissan-cdn.net/content/dam/Nissan/israel/brochures/Nissan-NV200-Brochure.pdf",
      "kind": "importer",
      "note": "קטלוג מפרט טכני של ניסאן ישראל (גרסה ישנה במטמון של www.nissan-cdn.net), מאשר את המרווח: NV200 K9K: מרווח טיפולים 30,000 ק\"מ או שנה"
    }
  ],
  "status": "reviewed",
  "notes": "לוח היבואן הישראלי ל-NV200 דיזל ללא וו גרירה: טיפול כל 30,000 ק\"מ או שנה; מסנן מזגן בכל טיפול; מסנן אוויר, מסנן סולר ונוזל בלמים כל 60,000; רצועת תזמון ומותח כל 150,000 ק\"מ או 5 שנים. לרכב עם וו גרירה החוברת קובעת טבלה נפרדת: טיפול כל 15,000 ק\"מ או שנה, עם החלפת מסנן אוויר, נוזל בלמים ומסנן סולר ב-60,000 ומסנן מזגן ב-30,000/60,000/90,000. כשהנסועה השנתית נמוכה ממרווח הק\"מ, הטיפולים נקבעים לפי הזמן (פעם בשנה). בתנאי נסיעה קשים (דרכים מאובקות, נסיעות קצרות חוזרות, גרירה, עבודה ממושכת בסרק, חום או קור קיצוניים, לחות או אזורים הרריים, דרכים משובשות או מדבריות, בלימות תכופות, נהיגה מהירה ממושכת, מונית ורכב לימוד) החוברת מפנה לטיפולים תכופים יותר בתיאום עם מרכז השירות, בלי טבלה נפרדת. "
}
