{
  "id": "chevrolet-traverse-2025-2026-2.5t",
  "make": "Chevrolet",
  "make_he": "שברולט",
  "model": "Traverse",
  "model_he": "טראוורס",
  "generation": "דור 3",
  "years": [
    2025,
    2026
  ],
  "engines": [
    "2.5 טורבו (LK0)"
  ],
  "fuel": "petrol",
  "importer": "יו.אם.איי",
  "interval": {
    "km": 12000,
    "months": 12,
    "note": "לפי ספר הנהג העברי של יו.אם.איי (2025): סבב צמיגים וביקורת רב-נקודתית כל 12,000 ק\"מ; שמן ומסנן לפי מחוון חיי השמן ולפחות פעם בשנה"
  },
  "cycle_km": 12000,
  "services": [
    {
      "km": 12000,
      "items": [
        {
          "item": "tire_rotation",
          "action": "rotate"
        },
        {
          "item": "engine_oil",
          "action": "replace",
          "note": "לפי מחוון חיי השמן (בודקים בכל טיפול), ולפחות פעם בשנה"
        },
        {
          "item": "oil_filter",
          "action": "replace",
          "note": "יחד עם השמן"
        },
        {
          "item": "air_filter",
          "action": "inspect",
          "note": "לפי מחוון חיי מסנן האוויר; מחליפים כשמוצגת הודעה"
        },
        {
          "item": "diagnostics",
          "action": "inspect",
          "note": "ביקורת רב-נקודתית (MPVI): היסטוריית שירות וקריאות חוזרות"
        },
        {
          "item": "lights",
          "action": "inspect"
        },
        {
          "item": "wipers",
          "action": "inspect"
        },
        {
          "item": "battery_12v",
          "action": "inspect"
        },
        {
          "item": "body_underside",
          "action": "inspect",
          "note": "בדיקת נזילות: מנוע, גיר, סרן, תיבת העברה, קירור, הגה, דלק"
        },
        {
          "item": "washer_fluid",
          "action": "inspect"
        },
        {
          "item": "tires",
          "action": "inspect",
          "note": "לחץ, עומק חריצים ובלאי"
        },
        {
          "item": "brake_pads",
          "action": "inspect"
        },
        {
          "item": "brake_discs",
          "action": "inspect"
        },
        {
          "item": "seat_belts",
          "action": "inspect"
        },
        {
          "item": "exhaust",
          "action": "inspect"
        },
        {
          "item": "pedals",
          "action": "inspect",
          "note": "דוושת ההאצה"
        },
        {
          "item": "coolant_hoses",
          "action": "inspect",
          "note": "צינורות גמישים"
        },
        {
          "item": "drive_belt",
          "action": "inspect"
        },
        {
          "item": "suspension",
          "action": "inspect",
          "note": "בולמים ותמוכות"
        },
        {
          "item": "steering",
          "action": "inspect"
        },
        {
          "item": "cv_boots",
          "action": "inspect"
        },
        {
          "item": "evap_system",
          "action": "inspect"
        },
        {
          "item": "door_hinges",
          "action": "clean",
          "note": "סיכת רכיבי השלדה והמרכב"
        },
        {
          "item": "cabin_filter",
          "action": "replace",
          "note": "או כל 12 חודשים"
        }
      ]
    }
  ],
  "long_interval": [
    {
      "item": "spark_plugs",
      "action": "replace",
      "every_km": 90000,
      "note": "כולל בדיקת מוליכי המצתים"
    },
    {
      "item": "differential_oil",
      "action": "replace",
      "every_km": 240000,
      "note": "סרן אחורי, AWD בלבד (בשימוש מאומץ: כל 120,000)"
    },
    {
      "item": "coolant",
      "action": "replace",
      "every_km": 240000,
      "every_months": 72,
      "note": "ריקון ומילוי מערכת הקירור"
    },
    {
      "item": "transmission_oil",
      "action": "replace",
      "every_km": 70000,
      "note": "שימוש מאומץ בלבד (פקקים בחום, הרים, גרירה, מונית)"
    }
  ],
  "time_based": [
    {
      "item": "engine_oil",
      "action": "replace",
      "months": 12,
      "every_months": 12,
      "note": "לפחות פעם בשנה, גם אם המחוון לא הורה"
    },
    {
      "item": "brake_fluid",
      "action": "replace",
      "months": 60,
      "every_months": 60,
      "note": "כל 5 שנים"
    },
    {
      "item": "ac_system",
      "action": "replace",
      "months": 84,
      "every_months": 84,
      "note": "החלפת חומר הייבוש של המזגן כל 7 שנים"
    }
  ],
  "specs": {
    "engine_oil": "שמן במפרט dexos1 (מומלץ סינתטי מלא) בצמיגות לפי הספר",
    "coolant": "DEX-COOL מהול 50/50 במים נקיים",
    "brake_fluid": "DOT 4",
    "_note": "נבדק מול ספר הנהג העברי של היבואן (2025)"
  },
  "sources": [
    {
      "url": "https://www.chevrolet.co.il/media/elxny4sy/24_chev_traverse_om_he_il_i_il_bh31124_2024feb07_hi_compressed-1.pdf",
      "kind": "importer",
      "note": "ספר נהג שברולט טראוורס 2025, יו.אם.איי (PATAC-localized-Israel), \"תכנית תחזוקה\" ו-MPVI עמ' 307-311"
    },
    {
      "url": "https://www.chevrolet.co.il/%D7%A9%D7%99%D7%A8%D7%95%D7%AA-%D7%A9%D7%91%D7%A8%D7%95%D7%9C%D7%98/%D7%A1%D7%A4%D7%A8-%D7%A8%D7%9B%D7%91/",
      "kind": "importer",
      "note": "דף ספרי הרכב באתר שברולט ישראל (נקרא דרך WebFetch; האתר חוסם curl)"
    }
  ],
  "status": "reviewed",
  "notes": "הלוח לקוח מספר הנהג העברי של יו.אם.איי לטראוורס 2025 (2.5 טורבו). הפתיח בספר ממליץ על ביקור כל 10,000 ק\"מ, אבל טבלת התחזוקה עצמה בנויה על 12,000 ק\"מ: סבב צמיגים, ביקורת רב-נקודתית (MPVI), סיכת השלדה, בדיקת השמן ואחוז חיי השמן (החלפה לפי המחוון ולפחות פעם בשנה), מסנן אוויר לפי מחוון חיי המסנן, ומסנן מזגן (או כל 12 חודשים). מצתים כל 90,000 (לא נופל על כפולה של 12,000 ולכן מופיע רק ברשימת הפריטים ארוכי הטווח), בוכנות הגז כל 160,000 או 10 שנים (אין מפתח פריט במאגר), ב-240,000 נוזל קירור (או 6 שנים) ושמן סרן אחורי ב-AWD. נוזל בלמים כל 5 שנים, מייבש המזגן כל 7 שנים."
}
