{
  "id": "chery-tiggo-4-hybrid-2025-2026-1.5-hev",
  "make": "Chery",
  "make_he": "צ'רי",
  "model": "Tiggo 4 Hybrid",
  "model_he": "טיגו 4 היברידי",
  "generation": "Tiggo 4 CSH (Tiggo Cross HEV)",
  "years": [
    2025,
    2026
  ],
  "engines": [
    "1.5 + DHT hybrid (SQRG4G15)"
  ],
  "fuel": "hybrid",
  "importer": "פריסבי",
  "interval": {
    "km": 10000,
    "months": 6,
    "note": "לפי לוח השירות של צ'רי מלזיה ל-Tiggo Cross 1.5 DHT: כל 10,000 ק\"מ או 6 חודשים"
  },
  "cycle_km": 120000,
  "services": [
    {
      "km": 10000,
      "items": [
        {
          "item": "engine_oil",
          "action": "replace"
        },
        {
          "item": "oil_filter",
          "action": "replace",
          "note": "כולל אטם בורג הניקוז"
        },
        {
          "item": "wheel_alignment",
          "action": "inspect",
          "note": "כיוון ואיזון מומלצים כל 10,000 ק\"מ"
        }
      ]
    },
    {
      "km": 20000,
      "items": [
        {
          "item": "engine_oil",
          "action": "replace"
        },
        {
          "item": "oil_filter",
          "action": "replace",
          "note": "כולל אטם בורג הניקוז"
        },
        {
          "item": "air_filter",
          "action": "replace",
          "note": "'Element air filter' בלוח - כנראה מסנן האוויר של המנוע"
        },
        {
          "item": "wipers",
          "action": "replace",
          "note": "פריט מומלץ"
        },
        {
          "item": "wheel_alignment",
          "action": "inspect",
          "note": "כיוון ואיזון מומלצים כל 10,000 ק\"מ"
        }
      ]
    },
    {
      "km": 30000,
      "items": [
        {
          "item": "engine_oil",
          "action": "replace"
        },
        {
          "item": "oil_filter",
          "action": "replace",
          "note": "כולל אטם בורג הניקוז"
        },
        {
          "item": "spark_plugs",
          "action": "replace"
        },
        {
          "item": "wheel_alignment",
          "action": "inspect",
          "note": "כיוון ואיזון מומלצים כל 10,000 ק\"מ"
        }
      ]
    },
    {
      "km": 40000,
      "items": [
        {
          "item": "engine_oil",
          "action": "replace"
        },
        {
          "item": "oil_filter",
          "action": "replace",
          "note": "כולל אטם בורג הניקוז"
        },
        {
          "item": "air_filter",
          "action": "replace",
          "note": "'Element air filter' בלוח - כנראה מסנן האוויר של המנוע"
        },
        {
          "item": "brake_fluid",
          "action": "replace"
        },
        {
          "item": "transmission_oil",
          "action": "replace",
          "note": "שמן תיבת DHT"
        },
        {
          "item": "coolant",
          "action": "replace",
          "note": "פריט מומלץ"
        },
        {
          "item": "wipers",
          "action": "replace",
          "note": "פריט מומלץ"
        },
        {
          "item": "wheel_alignment",
          "action": "inspect",
          "note": "כיוון ואיזון מומלצים כל 10,000 ק\"מ"
        }
      ]
    },
    {
      "km": 50000,
      "items": [
        {
          "item": "engine_oil",
          "action": "replace"
        },
        {
          "item": "oil_filter",
          "action": "replace",
          "note": "כולל אטם בורג הניקוז"
        },
        {
          "item": "wheel_alignment",
          "action": "inspect",
          "note": "כיוון ואיזון מומלצים כל 10,000 ק\"מ"
        }
      ]
    },
    {
      "km": 60000,
      "items": [
        {
          "item": "engine_oil",
          "action": "replace"
        },
        {
          "item": "oil_filter",
          "action": "replace",
          "note": "כולל אטם בורג הניקוז"
        },
        {
          "item": "air_filter",
          "action": "replace",
          "note": "'Element air filter' בלוח - כנראה מסנן האוויר של המנוע"
        },
        {
          "item": "spark_plugs",
          "action": "replace"
        },
        {
          "item": "wipers",
          "action": "replace",
          "note": "פריט מומלץ"
        },
        {
          "item": "brake_pads",
          "action": "replace",
          "note": "פריט מומלץ: קדמיות ואחוריות"
        },
        {
          "item": "wheel_alignment",
          "action": "inspect",
          "note": "כיוון ואיזון מומלצים כל 10,000 ק\"מ"
        }
      ]
    },
    {
      "km": 70000,
      "items": [
        {
          "item": "engine_oil",
          "action": "replace"
        },
        {
          "item": "oil_filter",
          "action": "replace",
          "note": "כולל אטם בורג הניקוז"
        },
        {
          "item": "wheel_alignment",
          "action": "inspect",
          "note": "כיוון ואיזון מומלצים כל 10,000 ק\"מ"
        }
      ]
    },
    {
      "km": 80000,
      "items": [
        {
          "item": "engine_oil",
          "action": "replace"
        },
        {
          "item": "oil_filter",
          "action": "replace",
          "note": "כולל אטם בורג הניקוז"
        },
        {
          "item": "air_filter",
          "action": "replace",
          "note": "'Element air filter' בלוח - כנראה מסנן האוויר של המנוע"
        },
        {
          "item": "brake_fluid",
          "action": "replace"
        },
        {
          "item": "transmission_oil",
          "action": "replace",
          "note": "שמן תיבת DHT"
        },
        {
          "item": "coolant",
          "action": "replace",
          "note": "פריט מומלץ"
        },
        {
          "item": "wipers",
          "action": "replace",
          "note": "פריט מומלץ"
        },
        {
          "item": "wheel_alignment",
          "action": "inspect",
          "note": "כיוון ואיזון מומלצים כל 10,000 ק\"מ"
        }
      ]
    },
    {
      "km": 90000,
      "items": [
        {
          "item": "engine_oil",
          "action": "replace"
        },
        {
          "item": "oil_filter",
          "action": "replace",
          "note": "כולל אטם בורג הניקוז"
        },
        {
          "item": "spark_plugs",
          "action": "replace"
        },
        {
          "item": "wheel_alignment",
          "action": "inspect",
          "note": "כיוון ואיזון מומלצים כל 10,000 ק\"מ"
        }
      ]
    },
    {
      "km": 100000,
      "items": [
        {
          "item": "engine_oil",
          "action": "replace"
        },
        {
          "item": "oil_filter",
          "action": "replace",
          "note": "כולל אטם בורג הניקוז"
        },
        {
          "item": "air_filter",
          "action": "replace",
          "note": "'Element air filter' בלוח - כנראה מסנן האוויר של המנוע"
        },
        {
          "item": "wipers",
          "action": "replace",
          "note": "פריט מומלץ"
        },
        {
          "item": "wheel_alignment",
          "action": "inspect",
          "note": "כיוון ואיזון מומלצים כל 10,000 ק\"מ"
        }
      ]
    },
    {
      "km": 110000,
      "items": [
        {
          "item": "engine_oil",
          "action": "replace"
        },
        {
          "item": "oil_filter",
          "action": "replace",
          "note": "כולל אטם בורג הניקוז"
        },
        {
          "item": "wheel_alignment",
          "action": "inspect",
          "note": "כיוון ואיזון מומלצים כל 10,000 ק\"מ"
        }
      ]
    },
    {
      "km": 120000,
      "items": [
        {
          "item": "engine_oil",
          "action": "replace"
        },
        {
          "item": "oil_filter",
          "action": "replace",
          "note": "כולל אטם בורג הניקוז"
        },
        {
          "item": "air_filter",
          "action": "replace",
          "note": "'Element air filter' בלוח - כנראה מסנן האוויר של המנוע"
        },
        {
          "item": "spark_plugs",
          "action": "replace"
        },
        {
          "item": "brake_fluid",
          "action": "replace"
        },
        {
          "item": "transmission_oil",
          "action": "replace",
          "note": "שמן תיבת DHT"
        },
        {
          "item": "coolant",
          "action": "replace",
          "note": "פריט מומלץ"
        },
        {
          "item": "wipers",
          "action": "replace",
          "note": "פריט מומלץ"
        },
        {
          "item": "brake_pads",
          "action": "replace",
          "note": "פריט מומלץ: קדמיות ואחוריות"
        },
        {
          "item": "wheel_alignment",
          "action": "inspect",
          "note": "כיוון ואיזון מומלצים כל 10,000 ק\"מ"
        }
      ]
    }
  ],
  "long_interval": [],
  "time_based": [],
  "specs": {
    "_note": "טיוטה - לפי צ'רי מלזיה, לא נבדק מול ספר היבואן"
  },
  "sources": [
    {
      "url": "https://www.chery.my/wp-content/uploads/2026/09/3Chery-Service-Maintenance-Schedule_TIGGO-CROSS_2026.pdf",
      "kind": "manufacturer",
      "note": "Chery Malaysia, TIGGO CROSS Service Schedule & Pricing Guide (ספטמבר 2026), עמודים 1-2: גרסת 1.5L + DHT (HEV)"
    }
  ],
  "status": "draft",
  "notes": "אתר היבואן cheryisrael.co.il חסום (Imperva) ולא נמצא ספר עברי. Tiggo Cross במלזיה הוא Tiggo 4 בשווקים אחרים, וגרסת 1.5 DHT שלו היא אותה מערכת היברידית; לכן זו טיוטה לפי לוח השירות המלזי (אקלים חם, מרווח קצר: 10,000 ק\"מ או חצי שנה). בלוח: שמן ומסנן בכל טיפול, מסנן אוויר כל 20,000, מצתים כל 30,000, נוזל בלמים ושמן גיר כל 40,000 ק\"מ; נוזל קירור, מגבים ורפידות הם פריטים מומלצים. הלוח לא מתייחס למסנן המזגן בנפרד."
}
