{
  "make": "Peugeot",
  "make_he": "פיג'ו",
  "importer": "דוד לובינסקי (פיג'ו)",
  "time_based": [],
  "status": "draft",
  "id": "peugeot-407-307-2006-2011-2.0",
  "model": "407 / 307",
  "model_he": "407 / 307",
  "generation": "407, 307",
  "years": [
    2006,
    2011
  ],
  "engines": [
    "2.0 16V EW10A (RFJ)"
  ],
  "fuel": "petrol",
  "interval": {
    "km": 15000,
    "months": 12,
    "note": "לפי חוברת היבואן של סיטרואן לבנזין 2.0, עמודת תנאים קשים: 15,000 ק\"מ או שנה"
  },
  "cycle_km": 45000,
  "services": [
    {
      "km": 15000,
      "items": [
        {
          "item": "parking_brake",
          "action": "inspect",
          "note": "בדיקות בתוך הרכב (בלם חניה, צופר)"
        },
        {
          "item": "lights",
          "action": "inspect",
          "note": "פנסים ואורות"
        },
        {
          "item": "tires",
          "action": "inspect",
          "note": "מצב הצמיגים; תוקף ערכת תיקון התקר וחיישני לחץ האוויר אם קיימים"
        },
        {
          "item": "brake_pads",
          "action": "inspect",
          "note": "בדיקת בטיחות של הבלמים מתחת לרכב"
        },
        {
          "item": "steering",
          "action": "inspect",
          "note": "בדיקת בטיחות של ההיגוי"
        },
        {
          "item": "body_underside",
          "action": "inspect",
          "note": "דליפות ממעגלי הנוזלים ומתיבת ההילוכים"
        },
        {
          "item": "washer_fluid",
          "action": "inspect",
          "note": "השלמה לפי הצורך"
        },
        {
          "item": "brake_fluid",
          "action": "inspect",
          "note": "מפלס והשלמה לפי הצורך"
        },
        {
          "item": "diagnostics",
          "action": "inspect",
          "note": "בדיקת מחשבי הרכב, בדיקות הנדרשות לפי החוק, איפוס מחוון השירות ונסיעת מבחן"
        },
        {
          "item": "engine_oil",
          "action": "replace"
        },
        {
          "item": "oil_filter",
          "action": "replace"
        },
        {
          "item": "cabin_filter",
          "action": "replace",
          "note": "כל 15,000 ק\"מ או שנה"
        }
      ]
    },
    {
      "km": 30000,
      "items": [
        {
          "item": "parking_brake",
          "action": "inspect",
          "note": "בדיקות בתוך הרכב (בלם חניה, צופר)"
        },
        {
          "item": "lights",
          "action": "inspect",
          "note": "פנסים ואורות"
        },
        {
          "item": "tires",
          "action": "inspect",
          "note": "מצב הצמיגים; תוקף ערכת תיקון התקר וחיישני לחץ האוויר אם קיימים"
        },
        {
          "item": "brake_pads",
          "action": "inspect",
          "note": "בדיקת בטיחות של הבלמים מתחת לרכב"
        },
        {
          "item": "steering",
          "action": "inspect",
          "note": "בדיקת בטיחות של ההיגוי"
        },
        {
          "item": "body_underside",
          "action": "inspect",
          "note": "דליפות ממעגלי הנוזלים ומתיבת ההילוכים"
        },
        {
          "item": "washer_fluid",
          "action": "inspect",
          "note": "השלמה לפי הצורך"
        },
        {
          "item": "brake_fluid",
          "action": "inspect",
          "note": "מפלס והשלמה לפי הצורך"
        },
        {
          "item": "diagnostics",
          "action": "inspect",
          "note": "בדיקת מחשבי הרכב, בדיקות הנדרשות לפי החוק, איפוס מחוון השירות ונסיעת מבחן"
        },
        {
          "item": "engine_oil",
          "action": "replace"
        },
        {
          "item": "oil_filter",
          "action": "replace"
        },
        {
          "item": "cabin_filter",
          "action": "replace",
          "note": "כל 15,000 ק\"מ או שנה"
        }
      ]
    },
    {
      "km": 45000,
      "items": [
        {
          "item": "parking_brake",
          "action": "inspect",
          "note": "בדיקות בתוך הרכב (בלם חניה, צופר)"
        },
        {
          "item": "lights",
          "action": "inspect",
          "note": "פנסים ואורות"
        },
        {
          "item": "tires",
          "action": "inspect",
          "note": "מצב הצמיגים; תוקף ערכת תיקון התקר וחיישני לחץ האוויר אם קיימים"
        },
        {
          "item": "brake_pads",
          "action": "inspect",
          "note": "בדיקת בטיחות של הבלמים מתחת לרכב"
        },
        {
          "item": "steering",
          "action": "inspect",
          "note": "בדיקת בטיחות של ההיגוי"
        },
        {
          "item": "body_underside",
          "action": "inspect",
          "note": "דליפות ממעגלי הנוזלים ומתיבת ההילוכים"
        },
        {
          "item": "washer_fluid",
          "action": "inspect",
          "note": "השלמה לפי הצורך"
        },
        {
          "item": "brake_fluid",
          "action": "inspect",
          "note": "מפלס והשלמה לפי הצורך"
        },
        {
          "item": "diagnostics",
          "action": "inspect",
          "note": "בדיקת מחשבי הרכב, בדיקות הנדרשות לפי החוק, איפוס מחוון השירות ונסיעת מבחן"
        },
        {
          "item": "engine_oil",
          "action": "replace"
        },
        {
          "item": "oil_filter",
          "action": "replace"
        },
        {
          "item": "cabin_filter",
          "action": "replace",
          "note": "כל 15,000 ק\"מ או שנה"
        },
        {
          "item": "air_filter",
          "action": "replace",
          "note": "כל 45,000 ק\"מ"
        },
        {
          "item": "spark_plugs",
          "action": "replace",
          "note": "כל 45,000 ק\"מ"
        }
      ]
    }
  ],
  "long_interval": [
    {
      "item": "brake_fluid",
      "action": "replace",
      "every_months": 24,
      "note": "כל שנתיים"
    },
    {
      "item": "coolant",
      "action": "inspect",
      "first_km": 120000,
      "first_months": 48,
      "then_every_km": 15000,
      "then_every_months": 12,
      "note": "בדיקת נוזל הקירור: לראשונה ב-120,000 ק\"מ או 4 שנים, ואחר כך בכל טיפול"
    },
    {
      "item": "timing_belt",
      "action": "replace",
      "every_km": 120000,
      "every_months": 120,
      "note": "מנוע בנזין 2.0 ל' בתנאים קשים (בתנאים רגילים 140,000 ק\"מ או 10 שנים)"
    }
  ],
  "specs": {
    "timing": "רצועת תזמון",
    "_note": "טיוטה - לפי חוברת סיטרואן של היבואן (דגם אחות, אותו מנוע)"
  },
  "sources": [
    {
      "url": "https://web.archive.org/web/20120509205507/http://citroen.co.il/_Uploads/dbsAttachedFiles/CitroenWarrantyBook.pdf",
      "kind": "importer",
      "note": "חוברת השירות והאחריות העברית של סיטרואן (לובינסקי, מהדורה 08/2009, KGCIT0920) מאתר citroen.co.il, עותק web.archive.org מ-9.5.2012. מרווחים לפי סוג מנוע עמ' 11 (PDF 13), פעולות קבועות בכל טיפול עמ' 12 (PDF 14), פעולות נוספות לתנאים קשים עמ' 17-18 (PDF 19-20), רצועת תזמון ומסנן חלקיקים עמ' 19 (PDF 21)"
    }
  ],
  "notes": "מקור: חוברת השירות והאחריות העברית של סיטרואן מאותו יבואן (לובינסקי), שנותנת תוכנית לפי סוג המנוע; לא נמצאה חוברת פיג'ו מקבילה, ולכן זו טיוטה לפי הדגם האחות עם אותו מנוע PSA. החוברת נותנת שתי תוכניות: רגילה ותנאים קשים. רשימת התנאים הקשים כוללת שימוש מתמשך בארצות חמות (מעל 30 מעלות לעיתים קרובות) ובאזורים מאובקים, וכן נסיעות קצרות ושימוש עירוני, ולכן נבחרה עמודת התנאים הקשים. כל 15,000 ק\"מ או שנה: שמן, מסנן שמן ומסנן תא נוסעים; כל 45,000 ק\"מ גם מסנן אוויר ומצתים. נוזל בלמים כל שנתיים; רצועת תזמון כל 120,000 ק\"מ או 10 שנים. ברישוי: מנוע RFJ."
}
