{
  "id": "renault-twingo-2017-2019-0.9-tce",
  "make": "Renault",
  "make_he": "רנו",
  "model": "Twingo",
  "model_he": "טווינגו",
  "generation": "III",
  "years": [
    2017,
    2019
  ],
  "engines": [
    "0.9 TCe (H4B)"
  ],
  "fuel": "petrol",
  "importer": "פריסבי (קרסו)",
  "interval": {
    "km": 20000,
    "months": 12,
    "note": "טיפול כל 20,000 ק\"מ או שנה, המוקדם (מרווח היבואן הישראלי). בתוכנית רנו אוקראינה שממנה נלקחו הפריטים: כל 15,000 ק\"מ"
  },
  "cycle_km": 120000,
  "services": [
    {
      "km": 20000,
      "items": [
        {
          "item": "engine_oil",
          "action": "replace"
        },
        {
          "item": "oil_filter",
          "action": "replace"
        },
        {
          "item": "air_filter",
          "action": "replace"
        },
        {
          "item": "cabin_filter",
          "action": "replace"
        }
      ]
    },
    {
      "km": 40000,
      "items": [
        {
          "item": "engine_oil",
          "action": "replace"
        },
        {
          "item": "oil_filter",
          "action": "replace"
        },
        {
          "item": "air_filter",
          "action": "replace"
        },
        {
          "item": "cabin_filter",
          "action": "replace"
        }
      ]
    },
    {
      "km": 60000,
      "items": [
        {
          "item": "engine_oil",
          "action": "replace"
        },
        {
          "item": "oil_filter",
          "action": "replace"
        },
        {
          "item": "air_filter",
          "action": "replace"
        },
        {
          "item": "cabin_filter",
          "action": "replace"
        }
      ]
    },
    {
      "km": 80000,
      "items": [
        {
          "item": "engine_oil",
          "action": "replace"
        },
        {
          "item": "oil_filter",
          "action": "replace"
        },
        {
          "item": "air_filter",
          "action": "replace"
        },
        {
          "item": "cabin_filter",
          "action": "replace"
        }
      ]
    },
    {
      "km": 100000,
      "items": [
        {
          "item": "engine_oil",
          "action": "replace"
        },
        {
          "item": "oil_filter",
          "action": "replace"
        },
        {
          "item": "air_filter",
          "action": "replace"
        },
        {
          "item": "cabin_filter",
          "action": "replace"
        }
      ]
    },
    {
      "km": 120000,
      "items": [
        {
          "item": "engine_oil",
          "action": "replace"
        },
        {
          "item": "oil_filter",
          "action": "replace"
        },
        {
          "item": "air_filter",
          "action": "replace"
        },
        {
          "item": "cabin_filter",
          "action": "replace"
        }
      ]
    }
  ],
  "long_interval": [
    {
      "item": "spark_plugs",
      "action": "replace",
      "every_km": 30000
    },
    {
      "item": "brake_drums",
      "action": "clean",
      "every_km": 60000,
      "note": "ניקוי בלמי התוף האחוריים"
    },
    {
      "item": "drive_belt",
      "action": "replace",
      "every_km": 60000,
      "note": "ערכת רצועת אביזרים עם גלגלות"
    },
    {
      "item": "brake_fluid",
      "action": "replace",
      "every_km": 90000
    },
    {
      "item": "coolant",
      "action": "replace",
      "every_km": 90000
    }
  ],
  "sources": [
    {
      "url": "https://to.renault.ua/",
      "kind": "manufacturer",
      "note": "רנו אוקראינה, מחשבון הטיפולים הרשמי (https://www.renault.ua/maintenance/maintenance-calc.html, נתונים מ-API ציבורי של האתר https://to.renault.ua/api/v1/services, גרסאות Clio 0,9 (4053)): תוכנית ל-120,000 ק\"מ. לכל ק\"מ מוצגת רשימת פעולות \"Регламентне ТО\" (טיפול לפי תוכנית רנו) עם קודי פעולה וחלקים"
    },
    {
      "url": "https://www.dacia.co.il/about-dacia/faq.html",
      "kind": "importer",
      "note": "דף השאלות הנפוצות של דאצ'יה ישראל (קרסו/פריסבי, נקרא ב-r.jina.ai בסבב 5): טיפול תקופתי לרכבי בנזין ודיזל כל 20,000 ק\"מ או שנה; מונית ורכב לימוד כל 15,000 ק\"מ או חצי שנה. זה המקור היחיד של היבואן למרווח; לוח הפריטים של היבואן לא פורסם"
    },
    {
      "url": "https://www.renault.co.il/cars/clio/specifications.html",
      "kind": "importer",
      "note": "עמודי המפרט של רנו ישראל מפנים ל\"ספר הרכב ולחוברת אחריות ושירות\" לתוכנית התחזוקה; החוברת לא פורסמה ברשת (נבדק ב-r.jina.ai, מפת האתר ו-sitemap.xml)"
    }
  ],
  "status": "draft",
  "notes": "לוח הפריטים של היבואן בישראל לא פורסם. המרווח (20,000 ק\"מ או שנה) הוא של היבואן (דף דאצ'יה ישראל, שחל על בנזין ודיזל). הפריטים לקוחים מתוכנית הטיפולים הרשמית של רנו אוקראינה לאותו דגם ומנוע (מחשבון הטיפולים באתר היצרן, מבוסס על קודי הפעולה של רנו). באוקראינה הטיפול הוא כל 15,000 ק\"מ, ובכל טיפול מוחלפים שמן ומסנן שמן, מסנן אוויר, מסנן מזגן, יחד עם \"טיפול בסיסי\" שכולל לפי רנו 29 פעולות ובדיקות (הרשימה המפורטת לא מוצגת); כאן הם מוצגים בכל טיפול של 20,000. פריטים ארוכי טווח לפי ק\"מ (התוכנית לא נותנת להם מגבלת זמן): מצתים כל 30,000 ק\"מ; ניקוי בלמי התוף האחוריים כל 60,000 ק\"מ; ערכת רצועת אביזרים כל 60,000 ק\"מ; נוזל בלמים כל 90,000 ק\"מ; נוזל קירור כל 90,000 ק\"מ. התוכנית האוקראינית תכופה יותר מספרי רנו קוריאה שבשאר לוחות רנו (שם, למשל, מסנן האוויר מוחלף פעם בטיפול של 15,000-20,000 ק\"מ והמצתים כל 60,000). הטווינגו לא נמכרת באוקראינה; זו התוכנית של קליאו 4 עם אותו מנוע 0.9 TCe (H4B), כלומר לוח של דגם אח. בטווינגו המנוע מותקן מאחור ופריטי רצועה ובלמים עשויים להיות שונים.",
  "time_based": []
}
