{
  "id": "toyota-corolla-2013-2019-1.6",
  "make": "Toyota",
  "make_he": "טויוטה",
  "model": "Corolla",
  "model_he": "קורולה",
  "generation": "E170",
  "years": [
    2013,
    2019
  ],
  "engines": [
    "1.6 petrol (1ZR-FAE Valvematic, CVT)"
  ],
  "fuel": "petrol",
  "importer": "יוניון מוטורס",
  "interval": {
    "km": 15000,
    "months": 12,
    "note": "מרווח היבואן בישראל זהה למרווח האירופי."
  },
  "cycle_km": 120000,
  "services": [
    {
      "km": 15000,
      "items": [
        {
          "item": "engine_oil",
          "action": "replace"
        },
        {
          "item": "oil_filter",
          "action": "replace"
        },
        {
          "item": "air_filter",
          "action": "inspect"
        },
        {
          "item": "brake_pads",
          "action": "inspect"
        },
        {
          "item": "tire_rotation",
          "action": "rotate"
        },
        {
          "item": "wipers",
          "action": "inspect"
        },
        {
          "item": "battery_12v",
          "action": "inspect"
        },
        {
          "item": "diagnostics",
          "action": "inspect"
        }
      ]
    },
    {
      "km": 30000,
      "items": [
        {
          "item": "engine_oil",
          "action": "replace"
        },
        {
          "item": "oil_filter",
          "action": "replace"
        },
        {
          "item": "air_filter",
          "action": "replace"
        },
        {
          "item": "cabin_filter",
          "action": "replace"
        },
        {
          "item": "brake_fluid",
          "action": "replace"
        },
        {
          "item": "brake_pads",
          "action": "inspect"
        },
        {
          "item": "tire_rotation",
          "action": "rotate"
        },
        {
          "item": "battery_12v",
          "action": "inspect"
        },
        {
          "item": "diagnostics",
          "action": "inspect"
        }
      ]
    },
    {
      "km": 45000,
      "items": [
        {
          "item": "engine_oil",
          "action": "replace"
        },
        {
          "item": "oil_filter",
          "action": "replace"
        },
        {
          "item": "air_filter",
          "action": "inspect"
        },
        {
          "item": "brake_pads",
          "action": "inspect"
        },
        {
          "item": "tire_rotation",
          "action": "rotate"
        },
        {
          "item": "battery_12v",
          "action": "inspect"
        }
      ]
    },
    {
      "km": 60000,
      "items": [
        {
          "item": "engine_oil",
          "action": "replace"
        },
        {
          "item": "oil_filter",
          "action": "replace"
        },
        {
          "item": "air_filter",
          "action": "replace"
        },
        {
          "item": "cabin_filter",
          "action": "replace"
        },
        {
          "item": "brake_fluid",
          "action": "replace"
        },
        {
          "item": "cvt_oil",
          "action": "inspect",
          "note": "היצרן מגדיר \"לכל החיים\" בשימוש רגיל. מוסכים רבים בישראל מחליפים בין 60 ל-90 אלף."
        },
        {
          "item": "brake_pads",
          "action": "inspect"
        },
        {
          "item": "tire_rotation",
          "action": "rotate"
        },
        {
          "item": "battery_12v",
          "action": "inspect"
        }
      ]
    },
    {
      "km": 75000,
      "items": [
        {
          "item": "engine_oil",
          "action": "replace"
        },
        {
          "item": "oil_filter",
          "action": "replace"
        },
        {
          "item": "air_filter",
          "action": "inspect"
        },
        {
          "item": "drive_belt",
          "action": "inspect"
        },
        {
          "item": "brake_pads",
          "action": "inspect"
        },
        {
          "item": "tire_rotation",
          "action": "rotate"
        },
        {
          "item": "battery_12v",
          "action": "inspect"
        }
      ]
    },
    {
      "km": 90000,
      "items": [
        {
          "item": "engine_oil",
          "action": "replace"
        },
        {
          "item": "oil_filter",
          "action": "replace"
        },
        {
          "item": "air_filter",
          "action": "replace"
        },
        {
          "item": "cabin_filter",
          "action": "replace"
        },
        {
          "item": "brake_fluid",
          "action": "replace"
        },
        {
          "item": "drive_belt",
          "action": "inspect"
        },
        {
          "item": "brake_pads",
          "action": "inspect"
        },
        {
          "item": "tire_rotation",
          "action": "rotate"
        },
        {
          "item": "battery_12v",
          "action": "inspect"
        }
      ]
    },
    {
      "km": 105000,
      "items": [
        {
          "item": "engine_oil",
          "action": "replace"
        },
        {
          "item": "oil_filter",
          "action": "replace"
        },
        {
          "item": "air_filter",
          "action": "inspect"
        },
        {
          "item": "brake_pads",
          "action": "inspect"
        },
        {
          "item": "tire_rotation",
          "action": "rotate"
        },
        {
          "item": "battery_12v",
          "action": "inspect"
        }
      ]
    },
    {
      "km": 120000,
      "items": [
        {
          "item": "engine_oil",
          "action": "replace"
        },
        {
          "item": "oil_filter",
          "action": "replace"
        },
        {
          "item": "air_filter",
          "action": "replace"
        },
        {
          "item": "cabin_filter",
          "action": "replace"
        },
        {
          "item": "brake_fluid",
          "action": "replace"
        },
        {
          "item": "cvt_oil",
          "action": "inspect"
        },
        {
          "item": "drive_belt",
          "action": "inspect"
        },
        {
          "item": "brake_pads",
          "action": "inspect"
        },
        {
          "item": "tire_rotation",
          "action": "rotate"
        },
        {
          "item": "battery_12v",
          "action": "inspect"
        }
      ]
    }
  ],
  "time_based": [
    {
      "item": "coolant",
      "action": "replace",
      "months": 120,
      "note": "החלפה ראשונה ב-160 אלף ק\"מ או 10 שנים (מסמכים ישנים: 120 אלף / 8 שנים), אחר כך כל 80 אלף"
    },
    {
      "item": "spark_plugs",
      "action": "replace",
      "months": 0,
      "note": "מצתי אירידיום (Denso SC20HR11). הנתון האירופי לא אומת. בארה\"ב: כ-190 אלף ק\"מ."
    }
  ],
  "sources": [
    {
      "url": "https://www.toyota.co.il/company/news/service-and-maintenance",
      "kind": "importer",
      "note": "מרווח 15,000 ק\"מ / 12 חודשים"
    },
    {
      "url": "https://www.toyota.co.il/owners/warranty",
      "kind": "importer",
      "note": "לוח טיפולים להורדה. חסום מהסביבה, לא נקרא."
    },
    {
      "url": "https://knufia.org/",
      "kind": "forum",
      "note": "מדריך ישראלי לקורולה 2014: שמן ומסנן כל טיפול; נוזל בלמים, מסנן אוויר ומסנן מזגן כל טיפול שני"
    },
    {
      "url": "https://carsforum.co.il/topic/428440/",
      "kind": "forum",
      "note": "טיפול 60 אלף בקורולה: שמן, מסנן שמן, מסנן אוויר, מסנן מזגן, נוזל בלמים"
    },
    {
      "url": "https://www.gerritspeek.nl/auto/diversen/yaris_maintenance_schedule.pdf",
      "kind": "manufacturer",
      "note": "לוח טיפולים אירופי של טויוטה (יאריס): מסננים ונוזל בלמים מקסימום 30 אלף / 24 חודשים"
    },
    {
      "url": "https://carmaintenance.app/toyota-corolla-maintenance-schedule-2014-2018/",
      "kind": "other",
      "note": "משאבת ואקום Valvematic, CVT ללא החלפה, נוזל קירור SLLC"
    }
  ],
  "status": "draft",
  "notes": "שחזור ממסמכי אירופה ומקורות ישראליים משניים. הלוח הרשמי של היבואן לא נקרא. פריטים חלשים: מצתים ונוזל קירור.",
  "specs": {
    "_note": "טיוטה, לאימות מול ספר הרכב",
    "engine_oil": "0W-20 (מותר גם 5W-30)",
    "oil_capacity": "כ-4.2 ליטר",
    "coolant": "Toyota SLLC (ורוד), לא לערבב",
    "brake_fluid": "DOT 3",
    "fuel": "בנזין 95 אוקטן",
    "tires": "205/55 R16",
    "tire_pressure": "כ-2.3 בר, לפי המדבקה בדלת הנהג",
    "battery": "מצבר רגיל 12V, לוודא מידה מול הקיים",
    "timing": "שרשרת, ללא החלפה מתוכננת",
    "spare": "גלגל חלופי צר",
    "warranty": "3 שנים / 100,000 ק\"מ"
  }
}